{
  "$schema": "./short-version.schema.json",
  "assetPackId": "k189-short-ru",
  "version": "1.0.0",
  "language": "ru",
  "deck": {
    "id": "k189-short",
    "title": "K189 Business & Medical Center",
    "subtitle": "Многофункциональный коммерческий комплекс",
    "format": "short",
    "sectionCount": 16,
    "audience": ["медицинские операторы", "клиничные сети", "реабилитационные центры", "инвесторы", "девелоперы", "гостиничные и образовательные операторы"],
    "communicationGoal": "Показать подготовленный многофункциональный объект и мотивировать потенциального покупателя запросить документы и согласовать просмотр."
  },
  "branding": {
    "workingName": "K189",
    "descriptor": "Business & Medical Center",
    "locationShort": "г. Нальчик",
    "address": "г. Нальчик, ул. Кабардинская, 189"
  },
  "contact": {
    "phoneDisplay": "+7 964 033-01-86",
    "phoneHref": "tel:+79640330186",
    "email": "tomabloom@mail.ru",
    "emailHref": "mailto:tomabloom@mail.ru",
    "channels": ["WhatsApp", "Telegram", "Email"]
  },
  "globalNotes": [
    "1 000 м² и 20 соток — округленные маркетинговые показатели.",
    "Площадь около 1 000 м² включает кафе, площадь которого указана по данным собственницы.",
    "Технические характеристики и состав оборудования подтверждаются документами сделки.",
    "Возможные сценарии использования зависят от требований оператора и разрешительной документации."
  ],
  "sections": [
    {
      "id": "cover",
      "order": 1,
      "type": "cover",
      "eyebrow": "Инвестиционная возможность",
      "title": "K189 Business & Medical Center",
      "body": "Многофункциональный коммерческий комплекс.",
      "metrics": [
        {"factId":"marketing_total_area","value":"1 000 м²","label":"комплекс с кафе"},
        {"factId":"marketing_land_area","value":"20 соток","label":"собственный участок"},
        {"factId":"floors","value":"3 этажа","label":"функциональные уровни"}
      ],
      "imageIds": ["facade_wide"],
      "footer": "г. Нальчик · Российская Федерация"
    },
    {
      "id": "executive-summary",
      "order": 2,
      "type": "summary",
      "eyebrow": "Исполнительное резюме",
      "title": "Комплекс в одном предложении",
      "lead": "K189 Business & Medical Center — отдельно стоящий многофункциональный комплекс на Кабардинской, 189.",
      "body": "Медицинская инфраструктура, офисные пространства и гостиничный потенциал объединены в одном объекте. Существующая отделка позволяет сосредоточиться на адаптации проекта, а не на создании базы с нуля.",
      "imageIds": ["facade_sign"],
      "note": "Площадь указана в округленном маркетинговом формате и включает кафе."
    },
    {
      "id": "offer-composition",
      "order": 3,
      "type": "offer",
      "eyebrow": "Состав предложения",
      "title": "Что получает покупатель",
      "lead": "Единый имущественный комплекс для нового оператора или инвестора.",
      "items": [
        {"title":"Трехэтажный корпус","description":"около 1 000 м² вместе с кафе","factIds":["marketing_total_area"]},
        {"title":"Собственная земля","description":"20 соток огороженной территории","factIds":["marketing_land_area"]},
        {"title":"Оснащение","description":"кафе, медицинское оборудование и инженерная база","factIds":["cafe_area","medical_equipment_included","technical_infrastructure"]}
      ],
      "imageIds": ["covered_yard"],
      "note": "Кафе, оборудование и технические характеристики указаны по данным собственницы; состав закрепляется документами сделки."
    },
    {
      "id": "ready-base",
      "order": 4,
      "type": "feature",
      "eyebrow": "Ключевое отличие",
      "title": "Не коробка, а готовая база",
      "body": "Ухоженные интерьеры, функциональное зонирование и профильная инфраструктура сокращают путь от покупки к запуску проекта.",
      "callout": "Покупатель приобретает подготовленную основу для бизнеса.",
      "imageIds": ["waiting_area"]
    },
    {
      "id": "interior-quality",
      "order": 5,
      "type": "feature",
      "eyebrow": "Архитектура и качество",
      "title": "Интерьер не требует старта с нуля",
      "body": "Спокойная нейтральная отделка коммерческого уровня подходит для большинства сценариев и может заметно сократить объем первичных работ.",
      "callout": "Готовый коммерческий комплекс без необходимости начинать с капитального ремонта.",
      "imageIds": ["lobby_main"]
    },
    {
      "id": "floor-structure",
      "order": 6,
      "type": "structure",
      "eyebrow": "Функциональная структура",
      "title": "Три этажа — три роли",
      "items": [
        {"title":"1 этаж","description":"клиника и восстановительная медицина"},
        {"title":"2 этаж","description":"офисы и управление"},
        {"title":"3 этаж","description":"гостевой / гостиничный формат"},
        {"title":"На территории","description":"кафе около 125 м²","factIds":["cafe_area"]}
      ],
      "imageIds": ["stairs_1"],
      "note": "Площадь кафе указана по данным собственницы."
    },
    {
      "id": "physiotherapy",
      "order": 7,
      "type": "gallery-feature",
      "eyebrow": "Первый этаж",
      "title": "Физиотерапия — ключевой медицинский актив",
      "body": "Зал с реабилитационным оборудованием занимает центральное место в медицинской функции объекта.",
      "imageIds": ["physiotherapy_hero", "patient_room", "doctor_office"],
      "imageLabels": ["Зал физиотерапии", "Палата", "Кабинет врача"],
      "note": "Оборудование входит в предложение по данным собственницы; состав подтверждается перечнем имущества."
    },
    {
      "id": "clinic-corridor",
      "order": 8,
      "type": "photo-feature",
      "eyebrow": "Среда клиники",
      "title": "Коридор задает профессиональный уровень",
      "body": "Отдельные кабинеты, спокойная гамма и износостойкие покрытия формируют аккуратный маршрут пациента.",
      "imageIds": ["clinic_corridor_2"]
    },
    {
      "id": "offices",
      "order": 9,
      "type": "feature",
      "eyebrow": "Второй этаж",
      "title": "Офисы готовы к работе",
      "body": "Кабинетная планировка, естественное освещение и готовая отделка поддерживают административную, корпоративную или сервисную функцию.",
      "callout": "Пространство можно адаптировать под команду без капитальной перестройки.",
      "imageIds": ["office_storage"]
    },
    {
      "id": "guest-floor",
      "order": 10,
      "type": "gallery-feature",
      "eyebrow": "Третий этаж",
      "title": "Гостевой номер уже оформлен",
      "body": "Комната и общий коридор уже имеют теплый гостиничный характер.",
      "imageIds": ["hotel_room", "hotel_corridor_1"],
      "imageLabels": ["Гостевой номер", "Общий коридор"],
      "note": "Конкретная модель эксплуатации зависит от требований будущего оператора и разрешительной документации."
    },
    {
      "id": "territory",
      "order": 11,
      "type": "photo-feature",
      "eyebrow": "Территория",
      "title": "20 соток собственной земли",
      "body": "Огороженный участок, подъезд и просторная крытая входная зона формируют автономный городской объект.",
      "callout": "Парковка на территории и вдоль улицы — по данным собственницы.",
      "imageIds": ["covered_yard"],
      "factIds": ["marketing_land_area", "parking"]
    },
    {
      "id": "engineering",
      "order": 12,
      "type": "technical-list",
      "eyebrow": "Инженерия",
      "title": "База для ежедневной эксплуатации",
      "items": [
        {"title":"Электроснабжение","description":"подстанция, 380 В, генератор"},
        {"title":"Вода и тепло","description":"центральные сети, запас воды, газ"},
        {"title":"Климат","description":"вентиляция и сплит-системы"},
        {"title":"Связь","description":"оптоволоконный интернет"},
        {"title":"Безопасность","description":"пожарные системы и выходы"},
        {"title":"Контроль","description":"видеонаблюдение"}
      ],
      "factIds": ["technical_infrastructure"],
      "note": "Технические характеристики указаны по данным собственницы и подтверждаются технической документацией."
    },
    {
      "id": "use-scenarios",
      "order": 13,
      "type": "scenario-list",
      "eyebrow": "Возможности развития",
      "title": "Один объект — семь концепций",
      "items": [
        {"title":"Многопрофильная клиника"},
        {"title":"Реабилитационный комплекс"},
        {"title":"Эстетическая медицина"},
        {"title":"Гостинично-деловой комплекс"},
        {"title":"Корпоративный бизнес-центр"},
        {"title":"Образовательный центр"},
        {"title":"Филиал медицинской сети"}
      ],
      "note": "Концепция зависит от требований оператора и разрешительной документации."
    },
    {
      "id": "location",
      "order": 14,
      "type": "location",
      "eyebrow": "Локация",
      "title": "Кабардинская, 189 — деловой адрес",
      "body": "Комплекс расположен в сформированном городском окружении. По информации собственницы, рядом находятся Сбербанк, МФЦ, подразделения полиции, административные учреждения и коммерческие объекты.",
      "imageIds": ["street_front"],
      "factIds": ["address"],
      "note": "Состав окружающей инфраструктуры указан по информации собственницы."
    },
    {
      "id": "investment-logic",
      "order": 15,
      "type": "value-list",
      "eyebrow": "Инвестиционная логика",
      "title": "Гибкость — ключевой аргумент",
      "items": [
        {"title":"Готовая отделка","description":"вместо стартовой реконструкции"},
        {"title":"Разделение функций","description":"по этажам и направлениям"},
        {"title":"Свобода концепции","description":"единый оператор или несколько пользователей"},
        {"title":"Расширенный актив","description":"земля, кафе, оборудование и инфраструктура"}
      ],
      "callout": "Ценность K189 — в сочетании готовой базы и свободы нового сценария."
    },
    {
      "id": "contact",
      "order": 16,
      "type": "contact",
      "eyebrow": "Следующий шаг",